Market,Why Infinite?,Examples,Notables
Longevity & Preventive Health,Aging is universal; people will always pay to live longer and better.,"Personalized supplements, epigenetic diagnostics, anti-aging clinics","Altos Labs, Levels Health, Elysium"
AI Copilots & Productivity Assistants,Every knowledge worker wants more productivity; AI scales this.,"AI code copilots, research assistants, creative tools","OpenAI, Anthropic, Rewind AI"
Human Relationships & Companionship,Deep emotional connection is a permanent human need.,"AI romantic partners, social avatars, therapy bots","Replika, Pi (Inflection), Character.AI"
Alternative & Decentralized Living,"People are seeking better, cheaper, more meaningful living environments.","Co-living, digital nomad hubs, off-grid housing","Boxabl, Cabin, Outsite"
Interactive Entertainment & Digital Identity,"People crave play, expression, and digital status.","Creator platforms, avatar marketplaces, UGC games","Roblox, Epic Games, Ready Player Me"
Low-Code / No-Code Tooling,Everyone wants to build and automate without coding skills.,"Business automation, website builders, app creators","Zapier, Notion, Softr"
Climate Tech & Sustainability,Existential demand and regulatory push for green tech.,"Direct air capture, EV infrastructure, plant-based meat","Climeworks, Twelve, Form Energy"
Financial Enablement & Economic Sovereignty,Everyone wants more control and access to money.,"Micro-investing, AI wealth advisors, alt-credit scoring","Stripe, Chime, Monarch"
Learning & Reskilling for the AI Age,Rapidly changing work demands constant learning.,"AI-first learning, cohort-based courses, micro-degrees","Maven, BloomTech, Replit Learn"
Biotech Platformization,"Biology is programmable; endless drugs, diagnostics, materials.","mRNA platforms, CRISPR, AI-driven drug design","Moderna, Ginkgo Bioworks, Recursion"
Mental Health & Emotional Regulation,Stress and meaning-making are eternal struggles.,"AI-powered CBT, digital therapy, psychedelics","Headspace, BetterHelp, Mindbloom"
Personal Energy & Cognitive Performance,"Everyone wants more clarity, stamina, and peak flow.","Nootropics, sleep tech, wearable neurotech","Apollo Neuro, Eight Sleep, Thesis"
Hyper-Personalized Commerce,People want products shaped exactly for them.,"AI-curated shopping, custom skincare, 3D-printed clothes","Stitch Fix, Curology, True Fit"
Everything-as-a-Service (XaaS),Renting > owning; subscriptions everywhere.,"Hardware-as-a-service, legal-as-a-service","Canoo, Deel, OpenAI APIs"
Global Connectivity & Infrastructure Access,"Billions lack stable internet, power, or banking.","Satellite internet, solar microgrids, mesh networks","Starlink, Helium, Bboxx"
Solo Creator / Indie Entrepreneur Economy,"People want sovereignty and expression, not jobs.","Monetized newsletters, niche agencies, one-person SaaS","Gumroad, Ghost, Beehiiv"
At-Home Healthcare & Medical Autonomy,Aging populations demand self-service health.,"Diagnostic kits, remote care, AI triage","Everlywell, Hims & Hers, Forward"
Digital Sovereignty & Privacy Infrastructure,Growing desire for control over data and identity.,"Decentralized identity, encrypted comms, zero-knowledge proofs","Proton, Signal, Brave"
B2B Automation & Vertical SaaS,Every industry wants to digitize and automate.,"Legal tech, dental CRM, trucking dispatch","Vanta, Ramp, Flexport"
Space Economy,Long-term moonshots backed by private capital.,"Satellite deployment, asteroid mining, Earth observation","SpaceX, Rocket Lab, Planet"
"Trust, Reputation & Digital Proof",AI and remote work increase need for verifiable credentials.,"Proof-of-work history, deepfake detection, trust scores","Worldcoin, Proof of Humanity, LinkedIn"
Game Mechanics Applied to Real Life,People want motivation and structure from gamification.,"Habit-tracking RPGs, gamified fitness, social challenges","Duolingo, Levels, Epic Win"
Government Tech (GovTech),Governments run on legacy software; modernization is needed.,"Permitting, payments, compliance, benefits distribution","OpenGov, ClearGov, Estonia e-Gov"
Robotics-as-a-Service & Human Augmentation,Labor shortages fuel demand for physical automation.,"Delivery bots, eldercare robots, warehouse automation","Figure, Agility Robotics, Zipline"
Regenerative Agriculture & Food Security,Food chains are fragile; climate risk rises.,"Vertical farms, lab-grown meat, precision farming","Plenty, Upside Foods, Indigo Ag"
Second Brains & Personal Knowledge Management,Managing information is a superpower.,"AI-powered note-taking, memory recall agents","Notion, Obsidian, Mem"
Remote & Geo-Arbitraged Lifestyles,"People seek freedom, flexibility, tax benefits.","Nomad visas, mobile citizenship, libertarian enclaves","Nomad List, SafetyWing, Zuzalu"
Digital Safety for Kids & Families,Parents want to protect children in risky digital world.,"AI content filters, screen time controls, parental dashboards","Bark, Canopy, Qustodio"
DeathTech & Legacy Management,Mortality is universal; tech barely addresses it.,"Will automation, AI memorials, grief tools","Lantern, Everplans, Cake"
Neurodivergence & Cognitive Design,Systems are poorly designed for neurodivergent people.,"ADHD productivity tools, autism-friendly UIs","Elevate, MindMate, Cognoa"
Self-Expression & Identity Design,People continuously shape and perform identity.,"Avatar fashion, AI-assisted branding, voice skins","Zepeto, Genies, Facemoji"
Mass Migration & Mobility Infrastructure,Climate and conflict accelerate global shifts.,"Migration logistics, mobile legal identity, diaspora networks","Welcome.US, Refugee platforms"
Real-World Agentic Systems,Replacing human effort with autonomous agents creates leverage.,"AI agents for logistics, sales, recruiting","AutoGPT, AgentOps startups"
Cultural Preservation & Translation as a Service,Thousands of languages and cultures are inaccessible.,"AI dubbing, gesture translation, oral tradition digitization","HeyGen, Deepdub, Archive.org"
Micro-Communities & Curated Social Spaces,"Belonging requires intimacy, which large social networks lack.","Invite-only forums, AI-moderated groups","Geneva, Circle, Discord"
On-Demand Local Micro-Manufacturing,"People want things made quickly, locally, and customized.","3D printed furniture, pop-up factories","Glowforge, Formlabs"
AI-Native Companies & No-Employee Businesses,Company structure is reinvented with AI replacing orgs.,"1-person AI-run startups, autonomous LLCs","Devin AI, AI agency collectives"
Crisis Readiness & Resilience,"People want to prepare for pandemics, blackouts, cyberattacks.","Smart go-bags, resiliency maps","Judy, Citizen"
Time Optimization & Scheduling Intelligence,Everyone wants more control over their time.,"AI timeboxing, smart calendar agents","Reclaim.ai, Clockwise"
Life Infrastructure-as-a-Service,Busy people outsource admin and life management.,"AI life managers, decision offloading","Double, Magic, Butler.ai"